{
  "version": 1,
  "mode": "light",
  "colors": {
    "canvas": "#FFFFFF",
    "surface": "#FFFFFF",
    "card": "#FFFFFF",
    "textPrimary": "#2D3436",
    "textMuted": "#636E72",
    "textSubtle": "#7F8C8D",
    "textInverse": "#FFFFFF",
    "stroke": "#E9E7F6",
    "strokeSoft": "#F0EEF9",
    "grid": "#DFE6E9",
    "tableGrid": "#DDD8F7",
    "comparison": "#5038A6",
    "comparisonSoft": "#DDD8F7",
    "comparisonTint": "#F5F3FF",
    "comparisonBorder": "#D7D0F0",
    "sideA": "#FF4757",
    "sideATint": "#FFF1F3",
    "sideABorder": "#FFD1D7",
    "sideB": "#2E86DE",
    "sideBTint": "#EFF6FF",
    "sideBBorder": "#CDE3FF",
    "neutral": "#636E72",
    "neutralTint": "#F8F9FA",
    "neutralBorder": "#ECEFF1",
    "statusWarning": "#F59E0B",
    "statusSuccess": "#10B981",
    "chart1": "#FF4757",
    "chart2": "#2E86DE",
    "chart3": "#5038A6",
    "chart4": "#00B894",
    "chart5": "#00CEC9",
    "chart6": "#636E72",
    "chartSectorAgriculture": "#00B894",
    "chartSectorIndustry": "#FF4757",
    "chartSectorServices": "#5038A6",
    "chartAgeYoung": "#00CEC9",
    "chartAgeWorking": "#DFE6E9",
    "chartAgeElderly": "#5038A6"
  },
  "shadows": {
    "card": "0 6px 16px rgba(45,52,54,0.06)",
    "panel": "0 10px 28px rgba(45,52,54,0.07)",
    "soft": "0 12px 30px rgba(45,52,54,0.08)"
  }
}
