{
  "version": 1,
  "mode": "dark",
  "colors": {
    "canvas": "#050505",
    "surface": "#111111",
    "card": "#1A1A1A",
    "textPrimary": "#FFFFFF",
    "textMuted": "#D4D4D8",
    "textSubtle": "#A1A1AA",
    "textInverse": "#050505",
    "stroke": "#3F3F46",
    "strokeSoft": "#27272A",
    "grid": "#3F3F46",
    "tableGrid": "#52525B",
    "comparison": "#F97316",
    "comparisonSoft": "#FDBA74",
    "comparisonTint": "#431407",
    "comparisonBorder": "#FB923C",
    "sideA": "#FB923C",
    "sideATint": "#431407",
    "sideABorder": "#F97316",
    "sideB": "#FDE68A",
    "sideBTint": "#422006",
    "sideBBorder": "#FACC15",
    "neutral": "#A1A1AA",
    "neutralTint": "#18181B",
    "neutralBorder": "#3F3F46",
    "statusWarning": "#F59E0B",
    "statusSuccess": "#34D399",
    "chart1": "#FB923C",
    "chart2": "#FDE68A",
    "chart3": "#F97316",
    "chart4": "#FED7AA",
    "chart5": "#A1A1AA",
    "chart6": "#FFFFFF",
    "chartSectorAgriculture": "#FDE68A",
    "chartSectorIndustry": "#F97316",
    "chartSectorServices": "#FDBA74",
    "chartAgeYoung": "#FED7AA",
    "chartAgeWorking": "#52525B",
    "chartAgeElderly": "#FB923C"
  },
  "shadows": {
    "card": "0 4px 10px rgba(0,0,0,0.28)",
    "panel": "0 6px 16px rgba(0,0,0,0.32)",
    "soft": "0 4px 12px rgba(249,115,22,0.28)"
  }
}
